{
  "$schema": "https://json-schema.org/draft/2020-12/schema",
  "$id": "https://github.com/SidianLabs/micro-agent-protocol/raw/main/schemas/execution-receipt.schema.json",
  "title": "MAP Execution Receipt",
  "type": "object",
  "additionalProperties": false,
  "required": [
    "receipt_id",
    "task_id",
    "agent_id",
    "action_taken",
    "resource_touched",
    "policy_checks",
    "timestamp",
    "result_hash",
    "signature"
  ],
  "properties": {
    "receipt_id": {
      "type": "string",
      "minLength": 1
    },
    "task_id": {
      "type": "string",
      "minLength": 1
    },
    "tenant_id": {
      "type": "string",
      "minLength": 1
    },
    "request_id": {
      "type": "string",
      "minLength": 1
    },
    "agent_id": {
      "type": "string",
      "minLength": 1
    },
    "action_taken": {
      "type": "string",
      "minLength": 1
    },
    "resource_touched": {
      "type": "string",
      "minLength": 1
    },
    "policy_checks": {
      "type": "array",
      "items": {
        "type": "string"
      }
    },
    "approval_used": {
      "type": "string"
    },
    "timestamp": {
      "type": "string",
      "format": "date-time"
    },
    "result_hash": {
      "type": "string",
      "minLength": 1
    },
    "requested_schema_version": {
      "type": "string",
      "pattern": "^[0-9]+\\.[0-9]+\\.[0-9]+$"
    },
    "executed_schema_version": {
      "type": "string",
      "pattern": "^[0-9]+\\.[0-9]+\\.[0-9]+$"
    },
    "negotiation": {
      "type": "object",
      "additionalProperties": false,
      "required": [
        "requested",
        "selected"
      ],
      "properties": {
        "requested": {
          "type": "object",
          "additionalProperties": false,
          "required": [
            "output_mode",
            "delivery_mode"
          ],
          "properties": {
            "schema_version": {
              "type": "string",
              "pattern": "^[0-9]+\\.[0-9]+\\.[0-9]+$"
            },
            "output_mode": {
              "type": "string",
              "enum": [
                "full",
                "summary",
                "structured_only",
                "receipt_only",
                "redacted",
                "debug"
              ]
            },
            "delivery_mode": {
              "type": "string",
              "enum": [
                "sync",
                "async"
              ]
            }
          }
        },
        "selected": {
          "type": "object",
          "additionalProperties": false,
          "required": [
            "output_mode",
            "delivery_mode"
          ],
          "properties": {
            "schema_version": {
              "type": "string",
              "pattern": "^[0-9]+\\.[0-9]+\\.[0-9]+$"
            },
            "output_mode": {
              "type": "string",
              "enum": [
                "full",
                "summary",
                "structured_only",
                "receipt_only",
                "redacted",
                "debug"
              ]
            },
            "delivery_mode": {
              "type": "string",
              "enum": [
                "sync",
                "async"
              ]
            }
          }
        },
        "provider_actions": {
          "type": "array",
          "items": {
            "type": "string",
            "enum": [
              "schema_translated"
            ]
          }
        }
      }
    },
    "signature": {
      "type": "string",
      "minLength": 1
    }
  }
}
